{
    "lecture_title": "Foundations of Artificial Intelligence",
    "assistant_email": "florian.pommerening@unibas.ch",
    "marking_mode": "exercise",
    "use_marks_file": true,
    "points_per": "exercise",
    "min_point_unit": 0.5,
    "tutor_list": [ "tamara", "tatiana", "terence" ],
    "max_team_size": 3,
    "teams": [
        [
            ["Salom√©", "Schmid", "salome.schmid@stud.unibas.ch"],
            ["Samira", "Studer", "samira.studer@stud.unibas.ch"],
            ["Silvan", "Stucki", "silvan.stucki@stud.unibas.ch"]
        ],
        [
            ["Sabine", "Sommer", "sabine.sommer@stud.unibas.ch"]
        ],
        [
            ["Sandro", "Schenk", "sandro.schenk@stud.unibas.ch"],
            ["Samuel", "Seiler", "samuel.seiler@stud.unibas.ch"]
        ]
    ]
}
