{
    "lecture_title": "Foundations of Artificial Intelligence",
    "assistant_email": "florian.pommerening@unibas.ch",
    "marking_mode": "static",
    "use_marks_file": true,
    "points_per": "sheet",
    "min_point_unit": 0.5,
    "max_team_size": 3,
    "classes": {
        "tamara": [
            [
                ["Sabine", "Sommer", "sabine.sommer@stud.unibas.ch"]
            ]
        ],
        "tatiana": [
            [
                ["Salom√©", "Schmid", "salome.schmid@stud.unibas.ch"],
                ["Samira", "Studer", "samira.studer@stud.unibas.ch"],
                ["Silvan", "Stucki", "silvan.stucki@stud.unibas.ch"]
            ]
        ],
        "terence": [
            [
                ["Sandro", "Schenk", "sandro.schenk@stud.unibas.ch"],
                ["Samuel", "Seiler", "samuel.seiler@stud.unibas.ch"]
            ]
        ]
    }
}
